{
  "$schema": "https://json-schema.org/draft/2020-12/schema",
  "$id": "https://miniflow.dev/contracts/project-config.schema.json",
  "title": "project-config · 项目初始化配置",
  "description": "projects/<id>/项目配置.json——每个 flow 初始化时读取的实例配置层。合并优先级：显式入参 > 本文件 > flow 默认值。目的：把用户的题材/需求/灵感/出品严肃性/风格/AB 决策在开跑前定死，让 flow 带着底气跑、避免返工。字段用中文键（用户直接手编）。",
  "type": "object",
  "required": ["项目"],
  "additionalProperties": true,
  "properties": {
    "项目": { "type": "string", "description": "项目 id，须与目录名一致" },
    "题材": { "type": "string", "description": "题材/赛道（组合进 direction 输入）" },
    "题材类型": {
      "type": "string",
      "enum": ["现实映射", "模板文"],
      "description": "现实映射=冲突动力来自现实关系（职场/都市/舆论等），S1 跑全套素材解剖（material-dissect）；模板文=冲突动力来自自足规则系统（无限流/修仙/穿越/系统等），S1 跳过实时解剖（flow 输入 zeitgeist=false）、直接走 kb/trope 梗族结构选型"
    },
    "创作目标": {
      "type": "string",
      "description": "本项目的商业/创作目标（如：快餐追读优先前三章进推荐池 / 稳健连载防断更 / 短剧 IP 改编向 / 练笔试错）——影响严肃性建议、卡点密度与打磨深度，随背景卡下发子代理"
    },
    "需求": { "type": "string", "description": "甲方需求与硬性要求（组合进 direction）" },
    "灵感": { "type": "string", "description": "灵感、情绪切入、结构参考（组合进 direction）" },
    "严肃性": {
      "type": "string",
      "enum": ["探索", "标准", "出品"],
      "description": "出品严肃性：探索=低成本试错（建议自动门+免AB）；标准=默认；出品=交付级（建议人工门+AB对照+全量打磨）"
    },
    "风格": {
      "type": "string",
      "enum": ["爽", "标准"],
      "description": "风格路线：爽=情绪浓度优先（route=hot）；标准=合理性优先（route=calm）。AB测试=true 时本字段被 route=dual 覆盖"
    },
    "AB测试": {
      "type": "boolean",
      "description": "是否跑 A/B 对照（双版本+监管基线件，S3 工作量约翻倍）——默认 false，除非出品级或甲方明确要求"
    },
    "市场预估": {
      "type": "string",
      "description": "基于市场快照（kb/market/snapshot）的人工预估笔记——随背景卡下发给每个子代理，作为选题与结构阶段的底气"
    },
    "presets": {
      "type": "object",
      "description": "可选：按阶段覆写执行模式（S1-S5: auto/semi/manual）。出品级建议人工门",
      "additionalProperties": { "type": "string", "enum": ["auto", "semi", "manual"] }
    },
    "阈值预算": {
      "type": "object",
      "description": "OS-02 阶段 C（2026-09-20）：阈值预算面。键名与合法区间白名单 = core/src/budget.ts::DEFAULT_BUDGET（出厂默认 + 项目可覆盖），未知键/非数/越界一律在任务包「阈值预算告警」区显式回显，绝不静默丢弃。合成优先级：flow.policy.budget（模板层） < 本键（实例层） < 项目 overlay 的 set-policy{budget}（运行时调整层）。消费点：assembler / aesthetic / optimize / metrics。",
      "additionalProperties": { "type": "number" }
    },
    "validation": {
      "type": "object",
      "description": "批次2.5 P1（2026-10-10）：校验标准声明位——「每个项目允许独立的文风、规则、校验标准」（需求1）的第三根支柱。立场：**声明位先行**——批次2.5 只做声明与配置回显；消费方已随批次3a P6（2026-10-10）接入：diag_scan 快诊断按 tierThreshold 定跑哪些分级通道、按 cardScope 装载哪家规则卡、按 severityFloor 过滤产出项（消费口径随动词响应 applied_validation 回显）；评审通道按 cardScope 选卡随批次3 后续。接入只增不改，本契约字段面未动。缺省语义（整块缺省 = 按各字段缺省值理解）：tierThreshold 缺省 [\"S\",\"A\"]（B 级主观审美归 agent 评审通道，不进确定性诊断）；cardScope 缺省 both（全局 knowledge/rules 卡与本项目 文风//规则/ 卡都参与评审）；severityFloor 缺省 minor（全优先级都报）。",
      "additionalProperties": false,
      "properties": {
        "tierThreshold": {
          "type": "array",
          "items": { "enum": ["S", "A", "B"] },
          "uniqueItems": true,
          "minItems": 1,
          "description": "本项目评审跑哪些分级（= rule-card@1 条款 tier：S=硬约束可精确定义 / A=有明确模式需上下文 / B=主观审美）。子集且不重复，缺省 [\"S\",\"A\"]"
        },
        "cardScope": {
          "enum": ["global", "project", "both"],
          "description": "规则卡装载范围：global=只用全局 knowledge/rules/ 域卡 / project=只用本项目 文风/ 与 规则/ 项目卡 / both=双家都装（缺省 both）。项目卡的形由 project-init 骨架模板给出（rule-card@1 信封）"
        },
        "severityFloor": {
          "enum": ["block", "major", "minor"],
          "description": "评审优先级下限（v5.0 去闸化语义：这是评审优先级，**不是提交闸**）。minor=全量都报（缺省）/ major=minor 不报 / block=只看最高优先"
        }
      }
    },
    "sessionBrief": {
      "type": "array",
      "items": { "type": "string" },
      "description": "批次3e 改稿套件改造（2026-10-12）：项目自述会话上下文声明位——无 flow 的改稿/协作会话靠它携带项目专属上下文，逐条以「- 」行追加进会话简报（storyharness buildProjectBrief 注入，每回合新鲜，与盘面事实同采信级）。写什么由项目主人定（典型：文风/规则卡路径与转正状态、外部资产库位置、协作纪律指针）；写不了行为只写事实与路径——纪律性指令放方法卡不放这里。整块缺省 = 无自述段，简报行为与历史完全一致。"
    },
    "openQuestions": {
      "type": "array",
      "description": "批次4 4.2（2026-10-12）：冷启动询问声明位——用户未指名时 agent 反问必要信息。来源：init 按领域预设（presets/skeletons/<domain>.json）预填必问清单（缺省 writing 不注入，--domain 显式给出才注入）；消费：随会话简报（storyharness buildProjectBrief「【待询问（冷启动）】」段，逐条带 question+options）下发给会话 agent。纪律：**询问归会话 agent，kit 不弹 UI**——会话 agent 见未答项必须逐条向用户询问，答案回填本条目的 answer 字段（写回 项目配置.json；全部答完注入段自动消失）。项目配置.json 是唯一事实源，手编亦可。",
      "items": {
        "type": "object",
        "required": ["key", "question"],
        "additionalProperties": false,
        "properties": {
          "key": {
            "type": "string",
            "description": "问题锚（项目内唯一）：注入对位与答案回填的键（如 产物类型/频道/题材/单章字数/mediaEndpoints）"
          },
          "question": {
            "type": "string",
            "description": "向用户询问的完整问题文案（图/视频相关问题的文案必须点明「拿不到生图接口不开工」）"
          },
          "options": {
            "type": "array",
            "items": { "type": "string" },
            "description": "可选：供用户选择的选项清单（自由作答的问题可省）"
          },
          "answer": {
            "type": "string",
            "description": "用户答案回填处（会话 agent 或用户本人写入；非空即视为已答，简报不再注入该条）"
          }
        }
      }
    },
    "mediaEndpoints": {
      "type": "object",
      "additionalProperties": true,
      "description": "批次4 4.2（2026-10-12）：生图/视频接口配置声明位——comfyui.endpoint 等生图/视频接口地址与参数（结构开放，键面随消费方定型）。图/视频领域 init 时经 openQuestions 强制询问，答案落这里（消费随图文视频解冻：批次3 裁决「停留在提示词层」，本声明位先行不接消费方）。"
    }
  }
}
