{
  "项目": "p-fq-001",
  "题材": "网文长篇连载（番茄小说平台，快餐抽象向）",
  "需求": "从近期（近30天）大梗热梗出发选题，主打快餐抽象；前三章试稿；最终成品必须去AI味（结构级），能过番茄 AI 检测口径",
  "灵感": "末世废土+神明降临+科技倒退；武魂式异能反差（别人火焰雷电，我的异能是只被认成饭勺的蓝色大肥鱼）；柯洁金铲铲式扮猪吃虎；神系按剧情分批引入",
  "严肃性": "探索",
  "风格": "爽",
  "AB测试": false,
  "市场预估": "番茄免费阅读大盘：前三章决定推荐池位与追读；快餐线日更2-3章需存稿；抽象梗文读者 = 学生党+年轻通勤族，对热梗脱敏快（梗生命周期2-8周），情境底座必须独立成立",
  "presets": {
    "S1": "semi",
    "S2": "auto",
    "S3": "auto",
    "S4": "semi"
  },
  "题材类型": "模板文",
  "创作目标": "快餐追读优先：前三章进推荐池、每章可切片；兼顾短剧 IP 改编潜力"
}